,en,fr
0,"Although, as you will have seen, the dreaded 'millennium bug' failed to materialise, still the people in a number of countries suffered a series of natural disasters that truly were dreadful.","Comme vous avez pu le constater, le grand ""bogue de l'an 2000"" ne s'est pas produit. En revanche, les citoyens d'un certain nombre de nos pays ont été victimes de catastrophes naturelles qui ont vraiment été terribles."
1,"It is nevertheless the case that not a penny more than what was allocated before the storm will now be freed up to demonstrate practical, active solidarity.","Il n'en demeure pas moins que pas un centime de plus que ce qui était distribué avant la tempête ne sera aujourd'hui libéré pour manifester une solidarité concrète, active."
2,"Furthermore, although there might be international consensus on the introduction of the scheme, the question would remain regarding how the tax revenue would be distributed.","En outre, quand bien même on parviendrait à une entente au niveau mondial sur l' adoption de cette taxe, il resterait la question du partage des produits de la taxation."
3,(NL) That the Florenz report has caused such a stir has been proven by the powerful lobby machine which has been set in motion by both industry and the environmental movement.,"(NL) L'ampleur des réactions suscitées par le rapport Florenz a été démontrée par la puissante machine de lobby qui a été mise en route, tant par l' industrie que par les mouvements écologistes."
4,"However, these isolated elements which make sense and for which we voted, in no way remedy the Eurofederalist philosophy which characterises the Community initiatives, particularly INTERREG.","Néanmoins, ces paragraphes, marqués au coin du bon sens et en faveur desquels nous avons voté, ne corrigent pas la philosophie eurofédéraliste qui caractérise les initiatives communautaires, notamment Interreg."
5,"It is good for us that we have the power to do this, in spite of the fact that we are not completely satisfied.","C'est une bonne chose pour nous que nous ayons le pouvoir de le faire, même si nous ne sommes pas pleinement satisfaits."
6,"Mr President, the agreement being promoted will be the first application of the Stability Pact in south-eastern Europe,","Monsieur le Président, l'accord proposé constituera la première application de l'accord de stabilité dans l'Europe du Sud-Est."
7,"Moreover, Europe is still the main destination for tourists from third countries, even though it faces increasingly stiff competition and an increasingly diversified and attractive range of products.","De plus l'Europe demeure la principale destination touristique des pays tiers, même si elle doit faire face à une concurrence de plus en plus forte et à une offre de plus en plus diversifiée et attrayante."
8,Fish escapes from aquaculture premises have been reported in the past and the virus has been found in wild stocks.,On a signalé par le passé la fuite de poissons de sites aquicoles et le virus a été détecté dans les stocks de poissons sauvages.
9,"Mr President of the Commission, when you entered upon your duties, you said that the Commission would be characterised by openness.","Monsieur le Président de la Commission, lorsque vous êtes entré en fonction, vous avez déclaré que la Commission serait marquée par l'esprit de transparence."
10,Infectious animal waste is not covered by the scope of this directive in its common position form because it is covered by Directive 90/667.,"Les déchets d'animaux malades n'entrent pas dans le champ d'application de cette directive dans sa forme de position commune, parce que ceux-ci sont couverts par la directive 90/667."
11,In response to a European Parliament resolution in 1997 the Commission has conducted an awareness-raising campaign on domestic violence within the Member States.,"À la suite de la résolution du Parlement européen de 1997, la Commission a mené une campagne de sensibilisation sur la violence domestique dans les États membres."
12,"The new regime can only win the new local elections, expected in May, if the opposition is, in effect, eliminated.","Seul le nouveau régime est en mesure de remporter les nouvelles élections municipales qui devraient avoir lieu en mai, puisque l'opposition en est tout simplement écartée."
13,"However, we in the Committee on Fisheries cannot really go to town, Commissioner, because you have still not provided us with the long-promised cost-benefit analyses on our fisheries agreements.","Car, si nous voulons maintenir nos produits sur le marché mondial, nous avons besoin de matières premières et d'importations, et cela a un prix. Mais nous ne pouvons même être exubérants et dépensiers au sein de la commission de la pêche, Madame la Commissaire, car vous nous privez des analyses coûts-bénéfices de nos accords de pêche alors qu'elles ont été promises de longue date."
14,I also want to remind colleagues that the amendments now proposed are new and therefore not based on the position Parliament took at first reading.,Je tiens également à rappeler à mes collègues que les amendements proposés maintenant sont nouveaux et qu'ils ne sont donc pas basés sur la position adoptée par le Parlement en première lecture.
15,"We have the blueprints and I urge all of those with the political will to take action, to deliver for the children of Africa.",Nous disposons d'un plan et j'exhorte tous ceux qui ont la volonté politique d'agir de sauver les enfants d'Afrique.
16,"I share the minority view of Mr Berthu, a member of the Union for a Europe of Nations Group, as it has been included in this report.","Je partage le point de vue de la minorité, donné par le membre de l' UEN Berthu, tel qu' il apparaît dans ce rapport."
17,"We can be sure that whatever money we have in this programme will be directed at youth and will, in the long-term, be money well spent.","Nous pouvons être certains que quel que soit l'argent dont nous disposerons pour ce programme, il sera destiné à la jeunesse et ce sera, à long terme, de l'argent bien dépensé."
18,"Mr President, first of all I should like to congratulate the rapporteur for bringing forward a report that not only looks at the problem but puts forward new ideas for the future.","Monsieur le Président, tout d' abord, je souhaite féliciter le rapporteur pour son rapport qui non seulement examine le problème mais propose de nouvelles idées pour l' avenir."
19,"It is clearly not a perfect text, but we consider it to be a reasonable and acceptable one, and it is crucial that it is adopted as soon as possible.","S'il n'est bien sûr pas parfait, nous estimons que ce texte est raisonnable et acceptable et qu'il est urgent de l'approuver."
20,"Although development cooperation and trade are very much interrelated, they should not be played off against each other.","Il est vrai que la coopération au développement et le commerce sont liés, mais ils ne peuvent être utilisés l' un contre l' autre."
21,"So far as Miss Kadeer is concerned, obviously I did not have notice of that question and am not in a position to respond.","En ce qui concerne Mlle Kadeer, manifestement je n'étais pas au courant de la situation et je ne suis donc pas en mesure de répondre à la question."
22,"I would argue that it is more essential, now that we have a strong public service broadcasting sector, to ensure the maintenance of that democratic, social and cultural sector.","J'aurais tendance à dire qu'il faut davantage garantir le maintien de ce secteur démocratique, social et culturel à présent que nous disposons d'un secteur de radiodiffusion publique fort."
23,"Unfortunately, with the exception of support for SMEs, we were unable to have any of these amendments adopted, and have therefore voted against the report.","Malheureusement, à l'exception du soutien en faveur des PME, nous n'avons pas pu faire adopter ces propositions, raison pour laquelle nous avons voté contre le rapport."
24,We have witnessed their pain and we have seen that terrorists do not of course only hurt those they attack; they also in essence murder all those around them.,"Nous avons vu leur douleur et nous avons vu que les terroristes ne frappent pas seulement les personnes qu' ils tuent mais aussi, en fait, tout leur entourage."
25,Mrs Anastassopoulos is in charge of these files. You surely do not imagine that there are 91 projects cofinanced by the Commission without a single official to deal with them.,Madame Anastassopoulos s'occupe de ces dossiers : vous ne pouvez quand même pas imaginer qu'il y ait 91 projets cofinancés par la Commission et qu'il n'y ait pas de fonctionnaires pour s'en occuper.
26,This is why we call upon the Commission and the Council to support this process by joining us in making representations to the Tunisian authorities.,C'est pour cela que nous demandons à la Commission et au Conseil de soutenir ce processus et que nous sollicitons également les autorités tunisiennes.
27,"Finally, if the Feira Council is going to deal with the Charter of Fundamental Rights we want it kept off the IGC agenda so that it can take the form of a statement not incorporated into the Treaty.","Enfin, si le Conseil de Feira examine la question de la charte des droits fondamentaux, nous lui demandons de ne pas l'inscrire à l'ordre du jour de la CIG afin de prendre, dès maintenant, la voie d'un document déclaratif non intégré dans le Traité."
28,"Madam President, I should like to begin by associating myself, as the Prime Minister has just done, with your moving tribute to President Pflimlin.",". (EN) Madame la Présidente, je voudrais tout d'abord m'associer, comme M. le Premier ministre vient de le faire, à votre émouvant hommage au président Pflimlin."
29,It is crucial that European aid has a direct bearing on the economic and social problems that are besetting the people of Zimbabwe.,"En effet, il est indispensable que l'aide européenne porte directement sur les difficultés économiques et sociales que connaît le peuple du Zimbabwe."
30,"It is the subsidies, tax relief and various forms of aid granted to big business which empty state coffers everywhere.","Ce sont les subventions, les dégrèvements fiscaux et les aides de toute sorte, accordées au grand patronat, qui vident partout les caisses des États."
31,That is why it was right - and I would like to specifically support you here - not to overburden this proposal with sensitive issues such as patent protection for biotechnology products.,"C'est pourquoi il était bon - et je voudrais vous appuyer -, de ne pas surcharger ce projet par des questions délicates telles que les brevets sur les produits biotechnologiques."
32,"Mr President, ladies and gentlemen, the European Commission is required to submit a directive proposal on measures for workers during pregnancy, birth and breastfeeding by the end of 2000.","Monsieur le Président, chers collègues, la Commission européenne devra introduire fin 2000 une proposition de directive impliquant des mesures destinées aux travailleuses enceintes, accouchées et allaitantes au travail."
33,Amendments 16 and 19 introduce interesting matters which I doubt would be a part of many other countries' criminal legislation.,"On a introduit dans les amendements 16 et 19 des éléments très intéressants, qui pour autant que je sache, ne pourraient exister dans la législation pénale de beaucoup de pays."
34,"Interventions of this kind should primarily take place with the help of economic sanctions but, depending upon the circumstances, military intervention may be necessary.","De telles interventions doivent d'abord prendre la forme de moyens de pression financière, mais, en fonction des circonstances, une intervention militaire peut s'avérer nécessaire."
35,This proposal does not say that all the Member States will be obliged to recognise unmarried partnerships and accept unmarried partners under all circumstances.,Cette proposition ne dit pas que tous les États membres seront obligés de reconnaître l'union de fait et d'admettre les partenaires dans toutes les circonstances.
36,"In the light of an inquiry at the time into the social and economic consequences of abolishing Community subsidies for tobacco cultivation, the decision was taken not to go down this path.","Au vu de l'analyse faite à l'époque des conséquences sociales et économiques d'une suppression de l'aide accordée à la culture du tabac, cette possibilité avait été rejetée."
37,I call on the Commission to make it crystal clear to the Russian Government that we will not accept further legal judgments against Nikitin or tolerate his being put on trial again.,"J'invite la Commission à signifier clairement au gouvernement russe que nous n'accepterons ni le maintien de sanctions judiciaires, ni l'ouverture de nouvelles procédures judiciaires à l'encontre de Nikitin."
38,"Firstly, I would like the Commissioner to explain why there is a contrast between the treatment of horizontal restraints and vertical restraints.","Premièrement, je voudrais que le commissaire explique pourquoi il existe une différence de traitement entre les restrictions horizontales et les restrictions verticales."
39,"Another aspect which was close to my heart is that parents, pupils and teachers too should be involved in the process.","Un autre aspect qui me tenait à cur est le fait qu'il faut également associer parents, élèves et enseignants au processus."
40,I thank Mr Parish for his report and wish his report all the best to ensure that we can follow up these important decisions taken by him in a specific and constructive manner.,Je remercie M. Parish pour son rapport et je lui souhaite bonne chance. Les décisions importantes qu'il a prises méritent un suivi ciblé et constructif.
41,"The MEPs of the Communist Party of Greece will never cease to condemn this EU policy, which aims to make third countries politically and economically dependent and suppress the grass-roots movement.","En tant que députés européens du Parti communiste de Grèce, nous ne cessons de dénoncer cette politique de l' UE qui vise la dépendance politique et économique des pays tiers et la répression du mouvement populaire."
42,"Progress has been made, as in the case of the approval in December of the measures on railway infrastructures through the conciliation procedure.","Des progrès ont été réalisés, comme celui de l'approbation, au mois de décembre, des mesures sur les infrastructures ferroviaires par la procédure de conciliation."
43,We should only concern ourselves with matters where the European Union can provide added value and can really be of significance.,Nous devons uniquement nous occuper des questions auxquelles l'Union européenne peut apporter une plus-value et pour lesquelles elle peut jouer un rôle véritablement important.
44,I do believe that consumer confidence is undermined if consumers see different responses in different Member States to the same perceived risk.,Je crois vraiment que la confiance des consommateurs est sapée si ceux-ci constatent que les États membres amènent des réponses différentes à ce qui est perçu comme un risque identique.
45,"Let us therefore first sort out the nature of the task in hand, and then we can find a name: I would be very happy to call it an assembly, a council or a committee, I do not mind.","Concentrons-nous donc sur les contenus, et nous pouvons trouver un nom ensuite : assemblée, conseil ou comité me vont très bien, peu importe."
46,"Now the Commission and the Council have come back with their common position, which is not 100 pages long, but 150 pages.","Et maintenant, voilà que la Commission et le Conseil reviennent avec une position commune qui ne fait pas 100 pages, mais bien 150 !"
47,"Mrs Ria, I regret, therefore, your zigzag course. When we look at your proposals, we find they do not tally with what you have said.","Chère Ria, je regrette donc votre progression en zigzag, car si vous considérez certains amendements déposés, et si nous considérons les amendements que vous avez déposés, nous n'y retrouvons pas ce que vous venez de dire."
48,"The purpose of these urgent topics we are now debating is, of course, to draw the public' s attention to serious problems in world politics and to serious violations of human rights and democracy.","Les affaires urgentes que nous examinons actuellement ont pour but d'attirer l'attention du public sur des problèmes graves en matière de politique internationale, sur des atteintes graves portées contre les droits de l'homme et la démocratie."
49,The Commission would also decide in future if and on what frequencies radio communications can be broadcast.,"De plus, la Commission devrait décider des fréquences de retransmission des contenus radiophoniques."
50,"In fact, the transport of radioactive waste presents the greatest risk due to the levels of radioactivity.","Ce sont bien les transports de déchets radioactifs qui présentent le danger maximal, vu leur taux de radioactivité."
51,"A Declaration was added to the Treaty of Amsterdam, stipulating that sports federations have a certain autonomy.","Une déclaration a été ajoutée au traité d'Amsterdam, qui stipule que les fédérations sportives ont une certaine autonomie."
52,"But that implies that many decisions can only be taken at the other end, at the higher level, when, for the sake of equity and efficiency, the whole of a great polity must be included.","Mais dans la pratique, ce souci d' efficacité et d' équité implique que de nombreuses décisions ne peuvent être prises qu' au plus haut niveau, et que tous les niveaux de pouvoir doivent être impliqués."
53,It was also pointed out that the development of the common European security and defence policy will contribute to the vitality of the renewed transatlantic connection.,On y souligne également que le développement de la politique européenne de sécurité et de défense commune contribuera à la vitalité de relations transatlantiques renouvelées.
54,This means that we cannot associate ourselves with any attempt to raise the profile of Cabinda' s political situation unless the Portuguese citizens are released.,Cela signifie que nous ne pourrons collaborer à aucun effort tendant à donner une visibilité à la question politique de Cabinda tant que les otages portugais ne seront pas libérés.
55,"These things are necessary, but they should not be the picture that is presented to the people of Europe.","Ces choses sont nécessaires, mais elle ne devraient pas constituer l'image présentée aux européens."
56,I would like specifically to refer to the area of employment in relation to this policy which is intended to create a barrier-free Europe and furthermore a Europe with a high level of employment.,"Je voudrais parler plus précisément du domaine de l'emploi dans cette politique qui tend à créer une Europe sans entrave et, en outre, une Europe présentant un taux d'emploi élevé."
57,"I should like to know whether you agree with this action by the Spanish government, which has sold a publicly owned company to a company from the United States?","Je voudrais savoir si vous êtes d'accord avec cette opération du gouvernement espagnol, qui a vendu cette entreprise publique à une entreprise américaine ?"
58,"In addition to short-term measures, however, we also need a new type of agricultural policy, which protects production and supports changes in production methods.","Mais, au-delà des mesures à court terme, il nous faut une autre politique agricole, qui protège la production et appuie la modification des méthodes de production."
59,"It is precisely this assistance, as rapporteur Swoboda pointed out with good reason, which benefits the stabilisation and association process in the entire region of the western Balkans.","Comme le fait remarquer judicieusement le rapporteur Swoboda, cette assistance profite non seulement à la Macédoine mais également au processus de stabilisation et d'association dans toute la région des Balkans occidentaux."
60,"Good laws are all very well, but they are just words on paper unless we have effective control and compliance.","Les bonnes lois, chers collègues, sont bien jolies, mais elles ne sont que du papier aussi longtemps que le contrôle et le respect des dispositions ne fonctionnent pas !"
61,I am also very glad that the Committee on Employment and Social Affairs has put forward these amendments.,Je suis aussi très satisfait que la Commission de l' emploi et des affaires sociales ait proposé ces amendements.
62,"The same can be said of the French government which, in its note of 9 May, sees no difficulty about using Article 308 in such a case.","On pourrait en dire autant du gouvernement français, d' ailleurs, qui dans sa note du 9 mai ne voit aucun inconvénient à l' utilisation de l' article 308 dans un tel cas."
63,"All right, perhaps that is the case, but democracy is a human creation after all, and only a human creation.","C'est peut-être vrai, mais la démocratie est avant tout et seulement une réalisation humaine."
64,"As for the lack of action following the election violence in Spain, described as a pogrom by commentators, this is not worthy of Europe.","L'absence de poursuites contre les violences ""d'Elexilo"" (Espagne) qualifié de ""pogrom"" par les commentateurs n'est pas digne de l'Europe."
65,"Many have seen generations of work literally go up in smoke on the funeral pyres, which are still burning.","De nombreuses personnes ont vu des générations de travail partir littéralement en fumée sur les bûchers, qui brûlent d'ailleurs toujours."
66,I believe we have reached a good agreement on the text and I am not proposing to support any additional amendments in the vote tomorrow.,Je pense que nous sommes parvenus à un bon consensus à propos de ce document et je ne souhaite pas proposer de soutenir d' autres amendements au vote de demain.
67,"We would have preferred no ceiling to be set, so that the compensation corresponded as closely as possible to the real need; in the meantime, I believe we should consider raising that ceiling.","Nous aurions préféré une absence de plafond afin que l'indemnisation soit la plus adaptée à la réalité, et en attendant, je pense qu'il faut envisager un relèvement du plafond."
68,The aid creates obligations but all the indications are that the president is trying to wriggle out of them.,"Cette aide crée des obligations, mais tout porte à croire que le président essaie d' y échapper."
69,"I say the words ""presidency of the Council"" advisedly because it is not, of course, the presidency of the Union.","Je dis ""présidence du Conseil"" délibérément, car il ne s'agit naturellement pas de la présidence de l'Union."
70,"That translates into more legal certainty, more confidence and an increase in e-commerce within the European Union.","Il s' agit de l' amendement 24. Ce qui implique un accroissement de la sécurité juridique, de la confiance, de la croissance aussi du commerce électronique au sein de l' Union européenne."
71,"An idea also seems to be circulating which I consider to be dangerous: that world competition, particularly North American competition, should promote mergers rather than guarantee pluralism.","Il semble même qu'il circule une idée que je trouve dangereuse : que la concurrence mondiale, en particulier américaine, favoriserait les concentrations plutôt qu'elle ne garantirait le pluralisme."
72,The line of aid discussed in this report seeks to fill the gap that exists between emergency aid and development aid.,La ligne d'aide à laquelle le présent rapport se réfère tente précisément de combler le fossé existant entre l'aide d'urgence et l'aide au développement.
73,The Commission' s report on the European works councils shows that there is a fair way to go before the law is implemented in practice and all the undertakings concerned have set up works councils.,Le rapport de la Commission sur les comités d'entreprise européens montre qu'il reste encore un bon bout de chemin à parcourir avant que la législation ne soit mise en uvre et que toutes les entreprises n'aient créé des conseils d'entreprise.
74,Integration is a mutual process that requires efforts on the part both of ourselves and of the future Member States.,"Une intégration est un processus mutuel, qui suppose des efforts aussi bien de notre part que de la part des futurs États membres."
75,"In spite of what some minority voices say, Mr Schmid was not more preoccupied with industrial espionage than with individual monitoring.","Contrairement à ce qu'affirment certains avis minoritaires, le rapporteur ne s'est pas montré plus préoccupé par l'espionnage économique que par les écoutes individuelles."
76,"I too wish to thank the Council of Ministers for its comprehensive answer, but I should nonetheless like the Council to be more specific.","Je voudrais à mon tour remercier le Conseil pour sa réponse étoffée, mais je souhaiterais tout de même une formulation plus concrète."
77,Much of the suffering of the last few months would have been unnecessary if the Commission had been prepared to accept preventive vaccination.,Une grande partie de la souffrance des derniers mois n' aurait pas été nécessaire si la Commission avait été disposée à accepter les vaccinations préventives.
78,"All the same, if you would allow me, I would like to say that I was disappointed by the remarks made by Mr Simpson earlier.",Vous me permettrez tout de même de dire que j'ai été touché par les remarques qui ont été faites par M. Simpson tout à l'heure.
