,en,fr
161,Their levels of efficiency throughout the Union must be improved by agreeing framework conditions for fair competition both between and in ports.,L'efficacité des ports doit être améliorée sur la totalité du territoire communautaire par l'application de conditions-cadres visant à instaurer une concurrence équitable tant au sein des ports qu'entre eux.
162,"Mr President, Commissioner, we all know that, in a larger EU, the ECB must be reformed, but the proposal presented by the ECB has not been sufficiently worked out.","Monsieur le Président, Monsieur le Commissaire, nous savons tous que la BCE au sein d'une Europe élargie doit être réformée, mais la proposition présentée par la BCE n'est pas suffisamment travaillée."
163,"Mr President, I speak as the PPE-DE Group spokesman on Islamic affairs and as a longstanding member of the Committee on Foreign Affairs, Human Rights, Common Security and Defence Policy.","Monsieur le Président, je m'exprime en tant que porte-parole du groupe PPE-DE sur les affaires islamiques et en tant que membre de longue date de la commission des affaires étrangères, des droits de l'homme, de la sécurité commune et de la politique de défense."
164,"The consumer organisations in the applicant countries are not yet, if I may put it like this, ideally equipped for their role as representatives of consumers.","Dans les pays candidats, les organisations de consommateurs ne sont pas encore, si je peux m'exprimer ainsi, armées de manière optimale pour remplir leur rôle de représentants des consommateurs."
165,"For Mr Rumsfeld, the American Secretary for Defence, to describe it - as he did yesterday - as a humanitarian act, is something I can regard only as cynicism of a fairly barbarous kind.","Si le ministre américain de la défense, M. Rumsfeld, l'a qualifiée hier d'acte humanitaire, cela relève à mes yeux d'un cynisme barbare !"
166,In so doing it will be guided by the proposals made by the Convention and in particular also by the work in the field of justice and internal affairs.,Elle se basera pour ce faire sur les propositions de la Convention et en particulier aussi sur les travaux effectués dans le domaine de la justice et des affaires intérieures.
167,"Mr President, Members of the European Parliament have exceptionally good grounds for self-criticism in this debate.","Monsieur le Président, les députés européens ont, dans le cadre de ce débat, vraiment matière à autocritique."
168,"For that reason, I do not, at twenty to ten in the evening, want to repeat what has already been said.","C'est la raison pour laquelle je ne souhaite pas, à 21 heures 40, répéter ce qui a déjà été dit."
169,"These times really do call for decisiveness and action, with the ultimate objective of promoting the defence identity of the European Union.","Les temps que nous traversons nous invitent à faire preuve d'esprit de décision et de volonté, avec pour objectif ultime le renforcement de l'identité de défense de l'Union européenne."
170,"Moreover, when it comes to phasing out, the Regulation lags far behind other provisions, such as, for example, the water framework directives.","En outre, le règlement est considérablement inférieur à d'autres réglementations - telles que les directives-cadres sur l'eau, par exemple - en matière d'élimination graduelle."
171,"I have no doubt that many people, including our green fundamentalists, would like to go much further.","Je suis convaincu que bon nombre d'entre nous, en particulier nos fondamentalistes verts, aimeraient aller beaucoup plus loin."
172,"Although the regulation is not perfect, it reflects a broad consensus on what rules should apply to this new form of cooperative enterprise.",Ce règlement n'est pas parfait. Il reflète cependant un large consensus sur les règles à appliquer à cette forme d'entreprise originale.
173,"Today, we are, however, saying quite clearly that we are holding meetings but that the results are rather far from being achieved.","Aujourd'hui, nous déclarons cependant de façon claire que nous organisons des réunions, mais que nous sommes assez loin d'un résultat."
174,This almost makes me want to ask the United Nations and its Health Organisation whether they think that the virus is aware of their positions on Taiwan's presence or otherwise in the United Nations.,"Ce qui me pousse également à demander aux Nations unies et à son Organisation de la santé si elles ont, par hasard, envisagé que le virus connaît leurs positions quant la présence ou non de Taïwan aux Nations unies."
175,There is a specific provision on the revision of this kind of bilateral agreement with the United States in case we decide to recognise the primacy of the European arrest warrant in the future.,"Il y a une disposition spécifique relative à la révision de ce type d'accord bilatéral conclu avec les États-Unis, au cas où nous déciderions à l'avenir de reconnaître la priorité de ce mandat d'arrêt européen."
176,It is to be hoped that the voices still raised to dispute that there is any difference between genetically-modified and conventionally bred organisms will at last fall silent.,Il faut espérer que les voix qui contestent encore toute différence entre les organismes génétiquement modifiés et ceux conçus de manière conventionnelle se tairont définitivement.
177,"Threats are commonplace, and some reference to the difficult position of human rights activists in Turkey would have been appropriate.",Les menaces sont monnaie courante et il aurait été opportun de faire référence à la situation difficile que connaissent les défenseurs des droits de l'homme en Turquie.
178,"Official controls are in the safe hands of veterinarians here and I hope they are duly appreciated, even by the consumer.",Les contrôles officiels sont entre les mains expertes des vétérinaires et j'espère que ces contrôles professionnels sont appréciés à leur juste valeur du côté des consommateurs.
179,"That is something we owe to ourselves, as well as to the Americans who, for many years, have been the guarantors of peace in Western Europe.","C'est une chose que nous nous devons à nous-mêmes, de même qu'aux Américains qui, pendant des années, ont été les garants de la paix en Europe de l'Ouest."
180,That poses undeniable problems relating to the quality of scrutiny of the prospectus and possible distortions of competition.,Cela pose indéniablement des problèmes en matière de qualité de l'examen du prospectus et de possibles distorsions de concurrence.
181,"Finally, there are a number of national consultation processes going on in the Member States on GM crops.","Enfin, un certain nombre de processus de consultation sont en cours dans les États membres sur les cultures génétiquement modifiées."
182,"That is why Europe's institutions need to be strong, and in the final analysis that must be the outcome of the debate on the constitution.",C'est pourquoi les institutions européennes doivent être fortes et tel doit être le résultat final du débat constitutionnel.
183,Dividing up the airspace into sectors could be brought about if necessary through qualified majority decisions.,"Diviser l'espace aérien en secteurs pourrait, si nécessaire, se concrétiser via des décisions à la majorité qualifiée."
184,"If, however, we compare the situation today with what happened at the last elections, things are better.","Mais si on compare la situation aujourd'hui à ce qui s'était passé aux dernières élections, elle est meilleure."
185,Such disasters are bound to lead us to review certain aspects of these occupations from the point of view of health and safety at work.,Ces catastrophes nous ont forcés à revoir certains aspects de santé et de sécurité des professions maritimes.
186,"Mr President, Eurostat has been publishing these accounts since 1964, producing them on the basis of a common methodology and sharing competence with the Member States.","Monsieur le Président, Eurostat publie ces rapports depuis 1964, il les élabore à partir d'une méthodologie commune, sur la base d'une compétence partagée avec les États membres."
187,"Any discussion of development should include the issue of debt, which was not, in fact, covered in the Commission document, although I concede that it was not strictly relevant.","Quand on parle de développement, on ne peut passer sous silence la question de la dette - même si elle n'y est pas étroitement liée -, question qui ne figurait pas dans le document de la Commission."
188,"Indeed, it is the question of the application of the Agreement and not of challenging it that is in the question from Mrs Morgantini and others.","En effet, il est bien question d'application et non de remise en cause de l'accord dans la question de Mme Morgantini et autres."
189,"Because he has been involved since the signing of the Maastricht Treaty, he knows very well that this is founded on two pillars: monetary union and economic union.","Acteur lors de la signature du traité de Maastricht, il sait bien que celui-ci repose sur deux piliers: l'union monétaire et l'union économique."
190,I would like to take this opportunity to expressly thank Mrs McNally and Mr Collins for their contributions to this work.,Je profite de cette occasion pour remercier Mme McNally et M. Collins pour leur contribution à ce travail.
191,What he said confirms precisely our position: that an attempt is being made to legalise the intervention in Iraq and the occupation and we are radically against any such development ...,"Ce qu'il a dit confirme exactement notre point de vue: nous assistons à une tentative visant à légitimer l'intervention en Irak et l'occupation de ce pays, et nous sommes radicalement opposés à un tel développement?"
192,"With amazon you can go on to make and accumulate purchases, so it might be imagined that, in the case of the European Commission, documents in use might immediately be traceable.","Sur Amazon, vous pouvez aussi faire vos courses et les mettre dans un panier. On pourrait donc imaginer, dans le cas de la Commission européenne, que les documents utilisés soient immédiatement traçables."
193,Our human social conscience tells us that unlawful trafficking in human beings and hopeful voyages undertaken under inhumane conditions cannot be tolerated.,Notre conscience humaine et sociale nous dit que le trafic illégal d’êtres humains et les voyages de l’espoir entrepris dans des conditions inhumaines ne peuvent être tolérés.
194,The only Community aid received to date resulted from reprogramming funds previously allocated to Spain.,La seule aide communautaire reçue jusqu’à présent découlait de la reprogrammation de fonds préalablement alloués à l’Espagne.
195,"At a time when we are going towards rail, here are people in my region trying to close down railways!","À un moment où nous nous orientons vers le chemin de fer, des personnes de ma région tentent de le supprimer!"
196,"And for this reason, I would like to express the reservations of the Commission over certain recommendations within the report.","Et, pour cette raison, je voudrais exprimer les réserves de la Commission sur certaines recommandations du rapport."
197,"In that respect, we have to conclude with some sense of shame that the average outgoings for each soldier in Belgium are three times lower than in the other European Member States.","À cet égard, il nous faut avouer avec une certaine honte que les dépenses moyennes par soldat sont trois fois moins élevées en Belgique que dans les autres États membres européens."
198,   . The aim of this directive is to introduce common safety targets (CSTs) and common safety methods (CSMs).,   Cette directive entend introduire des objectifs communautaires en matière de sécurité (OCS) et des méthodes communautaires en matière de sécurité (MCS).
199,"While sharing Parliament’s opinion on this point, it seems to us to be more appropriate to put this publicity obligation in the annex.","Tout en partageant l’avis du Parlement sur ce point, il nous semble plus approprié de faire figurer cette obligation de publicité dans l’Annexe."
200,"As Mr Bouwman said, they were promised an employment directive that would be implemented by Member States, and yet they see the Member States still dragging their feet.","Comme M. Bouwman l’a affirmé, on leur a promis une directive sur l’emploi qui serait appliquée par les États membres et, pourtant, ils voient les États membres continuer à traîner les pieds."
201,"So, Mr President of the Commission, he who would make Europe more transparent must be prepared to know his own tasks and pursue objectives in a consistent way.","Donc, Monsieur le Président de la Commission, celui qui voudrait rendre l’Europe plus transparente doit être prêt à connaître ses propres tâches et à poursuivre les objectifs d’une manière constante."
202,"Soil compaction and sealing are major adverse effects that infrastructure has on the soil, with consequences for the viability and condition of that soil.",Le tassement et l’imperméabilisation des sols sont des effets négatifs importants que les infrastructures ont sur les sols et qui entraînent des conséquences pour leur viabilité et leur condition.
203,"A first step in this direction could be to simplify the administrative formalities governing intra-Community transfers of defence products, and gradually to harmonise national licensing systems.","Un premier pas en ce sens consisterait à simplifier les formalités administratives qui réglementent les transferts intracommunautaires de produits de défense, et d’harmoniser progressivement les systèmes nationaux de licences."
204,Kofi Annan has appealed to Indonesia to ensure access to humanitarian aid and human rights organisations.,Kofi Annan a lancé un appel à l’Indonésie pour assurer l’accès des organisations humanitaires et des droits de l’homme.
205,"The Socialist Group therefore supports the conclusion of this agreement between the Community and Mozambique and congratulates the rapporteur, Mr Stevenson, who has produced a wonderful report.","Par conséquent, le groupe socialiste soutient la conclusion de cet accord entre la Communauté et le Mozambique et félicite le rapporteur, M. Stevenson, pour cet excellent rapport."
206,"The postal operator in my own country, Sweden, has noted that the annual average cost per household for letters and Christmas cards is SEK 190, or EUR 21.","Dans mon pays, la Suède, l’opérateur des services postaux a fait observer que le coût moyen par ménage pour les lettres et les cartes de Noël est de 190 SEK par an, soit 21 euros."
207,"The Council must respect Parliament now, and in the future must show more trust towards this House, which enjoys the legitimacy of the ballot box.","Le Conseil doit respecter aujourd’hui le Parlement et devra à l’avenir faire davantage confiance à notre Assemblée, qui bénéficie de la légitimité des urnes."
208,"We MEPs of the Communist Party of Greece voted against the resolution, not only because it fails to name the guilty parties, but also because it welcomes the interventionist role of the EU.","Les députés européens représentant le parti communiste grec ont voté contre la résolution, non seulement parce qu’elle ne fait aucune mention des parties responsables, mais également parce qu’elle se félicite du rôle interventionniste joué par l’Union européenne."
209,I am also pleased that it is the European Parliament's petitions procedure that has enabled that to happen.,Je suis aussi ravi que ce soit la procédure des pétitions du Parlement européen qui ait permis cela.
210,I assure you I do not suffer in this way anywhere else. Sudden drastic temperature changes should not be allowed.,Les changements soudains et drastiques de température ne devraient pas être permis.
211,It has come as a horrible shock to learn of the decision to prevent people from standing for election.,L’annonce de la décision d’interdire des personnes à se présenter aux élections a été un choc terrible.
212,"Our group is not willing to repeat the events of 1999, when one side won the elections and the other side took up offices in the Commission.","Notre groupe veut absolument éviter une répétition des événements de 1999, lorsqu’un côté a remporté les élections, tandis que l’autre côté s’est approprié les mandats au sein de la Commission."
213,"We have a situation in the Basque Country which is also difficult and worrying, and which is creating great tension and violence.",Le Pays Basque connaît lui aussi une situation difficile et inquiétante engendrant une tension et une violence considérables.
214,"Naturally, we acknowledge the very useful work done under the impetus of the Italian Presidency, which was the subject of the preparatory document for the ministerial meeting in Naples.","Naturellement, nous reconnaissons le travail très utile réalisé sous l’impulsion de la présidence italienne et qui a fait l’objet, notamment, du document préparatoire à la réunion ministérielle de Naples."
215,"The report takes up the cause of multilateralism and strengthening the role of the UN, which is right and good.","Le rapport se prononce en faveur du multilatéralisme et du renforcement du rôle de l’ONU, ce qui est juste et bien."
216,I believe Thailand should be completely delisted from all poultry meat exports until that country can prove it has the infrastructure and the integrity to apply EU standards all the time.,Je crois que la Thaïlande devrait être totalement rayée de la liste des exportateurs de viande de volaille jusqu’à ce qu’elle puisse prouver qu’elle possède l’infrastructure et l’intégrité nécessaires pour appliquer en permanence les normes fixées par l’UE.
217,"I also hope that we will be in a position to do this right here or in Brussels during an enlarged Conference of Presidents, but I am not sure of this yet.","J’espère d’ailleurs que nous serons en mesure de le faire ici même, ou à Bruxelles, au cours d’une conférence des présidents élargie, mais je n’en suis pas encore certain."
218,Perhaps this parallels the case taken by Israeli NGOs to the Israeli Supreme Court in protest against the barrier.,Peut-être cela équivaut-il à l’affaire portée par des ONG israéliennes devant la Cour suprême d’Israël pour protester contre la barrière.
219,"   – Mr President, I would like to bring to your attention, and to that of this House, something I regard as a very sad situation in Slovakia, our neighbour and soon to be a Member State.","   Monsieur le Président, je souhaiterais attirer votre attention ainsi que celle de l’Assemblée sur une situation que je considère très regrettable et qui concerne la Slovaquie - un de nos voisins et un prochain État membre."
220,"We, the old Member States, are now imposing transition periods with regard to the workforce in the new Member States.","Les anciens États membres que nous sommes imposent, à présent, des périodes transitoires à l’égard de la main-d’œuvre dans les nouveaux États membres."
221,"We have heard speeches from Members of the different political groups, including the big ones, expressing very different opinions.","Nous avons entendu des discours de députés des différents groupes politiques, y compris des grands, exprimer des avis très différents."
222,"The legislative activity of the Council of Ministers is to become more transparent, even though we will not get the legislative council we have asked for.","L’activité législative du Conseil de ministres gagnera en transparence, même si nous n’obtiendrons pas le conseil législatif que nous avons demandé."
223,"However, in Northern Ireland there is a feeling that neither the United Kingdom Government nor the European Union are looking at it favourably, as compared with other languages.","Cependant, l’Irlande du Nord a le sentiment que ni le gouvernement du Royaume-Uni, ni l’Union européenne ne la considèrent favorablement comparativement à d’autres langues."
224,"That is how, on the pretext of security and combating terrorism, the Olympic ideals are being profaned and a nation is basically being bound hand and foot.","Voilà comment, sous le prétexte de la sécurité et de la lutte contre le terrorisme, les idéaux olympiques sont bafoués et une nation se retrouve pieds et poings liés."
225,"Nor do I want to go into loading and unloading operations, temperature, etc. This is not justified either, which is what the report attempts to do in technical terms.","Je ne parlerai pas non plus des opérations de chargement et de déchargement, de la température, etc. Ces aspects ne sont pas justifiés non plus, ce que le rapport tente de faire en termes techniques."
226,It is important to realise that even waste that is not intrinsically or chemically hazardous can cause major environmental problems.,Il est essentiel de comprendre que même les déchets qui ne sont pas intrinsèquement ou chimiquement dangereux peuvent causer des problèmes importants dans l’environnement.
227,"This, again, is a complex issue and there is a need for greater clarity on how taxes and royalties for such operations are distributed.","À nouveau, cette question est complexe et une clarté accrue est nécessaire quant à la répartition des taxes et des redevances pour de telles opérations."
228,"We might have also expected a new social and democratic Europe to be put in place, as a challenge to the hegemony of the markets and of eurocracy.","On aurait pu également espérer la mise en chantier d’une autre Europe sociale et démocratique, en rupture avec la dictature des marchés et de l’eurocratie."
229,Point 4: we have followed the Kyoto Protocol in deciding that the construction of nuclear power stations is not permitted.,Point 4: nous avons respecté le protocole de Kyoto en décidant l’interdiction de toute nouvelle centrale nucléaire.
230,"As you know, my other battle was and will continue to be economic, social and now territorial cohesion and its future after 2007.","Vous le savez, mon autre combat a été et restera celui de la cohésion économique, sociale et désormais territoriale ainsi que son avenir après 2007."
231,At present it costs more to provide the assistance than in most other places because of the behaviour and activities of the security forces.,"Actuellement, fournir une aide humanitaire en Palestine coûte plus que dans la plupart des autres régions du monde, à cause du comportement et des agissements des forces de sécurité."
232,"The Commission’s promise to submit to us, in autumn, a new draft decision amending this system, is merely a decoy.",La promesse de la Commission de nous soumettre à l’automne un nouveau projet de décision modifiant ce système n’est qu’un leurre.
233,"I am seeing more and more well-motivated young politicians, both men and women, who want to do something.",Je vois de plus en plus de jeunes hommes et femmes politiques motivés désireux d’agir.
234,"We are relying on them today, just as the reform-minded forces in Belarussian, Ukrainian and Moldovan, society should be able to continue to rely on the European Union in the near future.","Nous nous en remettons à eux aujourd’hui, de même que les forces réformatrices des sociétés bélarussienne, ukrainienne et moldove doivent pouvoir continuer à s’en remettre à l’Union européenne dans un avenir proche."
235,The legislative legacy of this Parliament from 1999 to 2004 is one that will improve the quality of life of our peoples and lay down the conditions for improved prosperity.,L’héritage législatif laissé par ce Parlement entre 1999 et 2004 contribuera à améliorer la qualité de vie de nos peuples et à jeter les bases d’une meilleure prospérité.
236,"There is no need to convince you that twenty-first century asymmetric and transnational threats are not just illusions, but a reality.","Il n’est pas nécessaire, je présume, de vous convaincre que les menaces asymétriques et transnationales du XXIe siècle ne sont pas qu’une illusion et qu’elles existent réellement."
237,"I think that that is a good new way that improves quality and the provision of information, and that is an improvement on the way in which we deal with the Budget.","Je pense qu’il s’agit d’une nouvelle méthode efficace, qui améliore la qualité et la communication d’informations et optimise notre méthode d’examen du budget."
238,"If this local and regional reconstruction is successful, the people in the terrorist hotbeds can decide for themselves what will benefit them the most.","Si cette reconstruction locale et régionale est couronnée de succès, les personnes vivant au sein de foyers terroristes pourront décider elles-mêmes ce qui leur sera le plus profitable."
239,"The EU, which claims to be a global player, has a golden opportunity to ensure that people do not forget what is happening in Darfur and that those responsible do not go unpunished.","L’UE, qui prétend être un acteur mondial, a l’occasion rêvée de ne pas faire oublier aux gens ce qui se passe au Darfour et de faire en sorte que les responsables ne demeurent pas impunis."
240,"I look at the Council’s empty chair and I have the image of what has happened over the past five years in the area of freedom, security and justice.","Ce siège vide réservé au Conseil me renvoie l’image de ce qui s’est produit durant ces cinq dernières années dans l’espace de liberté, de sécurité et de justice."
