,en,fr
399,The Council is also continuing to urge Croatia to improve its administrative capacity and to effectively transpose and implement the acquis so that it can meet its membership obligations in due time.,"Le Conseil continue également à encourager la Croatie à améliorer sa capacité administrative et à transposer correctement et à mettre en œuvre l'acquis, pour pouvoir satisfaire aux obligations liées à l'adhésion en temps voulu."
400,"If we fail to do so, we will be faced with competition over which country gets more seats and which fewer.","À défaut, ce sera la compétition pour savoir quel pays aura plus de sièges et quel pays moins."
401,Those who are putting forward this motion for a resolution seem to believe that the debates of this House only matter if we adopt a resolution at the end of the debate.,Ceux qui lancent cette proposition de résolution semblent croire que les débats de cette Assemblée n'ont d'importance que si nous les concluons en adoptant une résolution.
402,"First of all, it is necessary to look into the ways of distributing the tax burden between the producer and the consumer.","D'abord, il est nécessaire d'étudier les moyens de répartir la charge fiscale entre le producteur et le consommateur."
403,Therefore my urgent recommendation: the Council needs to get a sufficient mandate so that we can put both Galileo and the Foreign and Security Policy on a firm footing - hopefully not only for 2008.,"Voici donc ma recommandation urgente: le Conseil doit obtenir un mandat suffisant pour que nous puissions placer Galileo et la politique étrangère et de sécurité commune sur une base solide - et pas seulement pour 2008, espérons-le."
404,"This is why I support the appeal by the Trade Commissioner, Mr Mandelson, who asked the EU and Russia to stop acting as two cities connected only by a narrow road and a gas pipeline.","C'est pourquoi je soutiens l'appel du commissaire au commerce, M. Mandelson, qui a demandé à l'UE et à la Russie d'arrêter d'agir comme deux villes uniquement reliées par une route étroite et un gazoduc."
405,"He comes from Spain, I come from Sweden, and both countries produce these dreadful weapons and both countries have promised to ban them.","Il vient d'Espagne, je viens de Suède, et ces deux pays produisent ces armes redoutables et ces deux pays ont promis de les interdire."
406,This applies to the funding of AMIS and to support ranging from logistics and military equipment to personnel.,"Cela s'applique au financement de la MUAS et au soutien, allant de la logistique au personnel, en passant par l'équipement militaire."
407,"I definitely support the scheme's so-called broad geographical scope, in other words the inclusion of all flights from and to the EU, regardless of the national attribution of the carrier.","Je suis tout à fait en faveur d'une base géographique globale, en d'autres termes, l'intégration de tous les vols en provenance et à destination de l'UE, quelle que soit l'affectation nationale du transporteur."
408,Mr Magalhães stated that the Euromed meeting on 18 and 19 November would be the first meeting by Euromed on immigration.,M. Magalhães a indiqué que la réunion Euromed des 18 et 19 novembre serait la première portant sur l'immigration.
409,"We see the pressure from outside; we see the social tensions and, indeed, the racism from inside the EU.","Nous sentons une pression qui vient de l'extérieur; nous observons des tensions sociales et, en effet, du racisme à l'intérieur de l'UE."
410,I believe - and you rightly referred to this - that questions such as the one under discussion arouse strong feelings among the general public.,Je crois - et vous l'avez à juste titre mentionné - que des questions comme celle qui est à l'étude suscitent des sentiments intenses parmi la population.
411,"However, in that spirit of Christmas compromise, we should like our Socialist friends in turn to accept our proposal for a resolution on the issue of Venezuela following the referendum there.","Néanmoins, dans cet esprit de compromis qui est celui de Noël, nous voudrions qu'en retour, nos amis socialistes acceptent notre proposition de résolution sur la question du Venezuela suite au référendum prévu dans ce pays."
412,"We have tough laws in Britain, but without this EU law guns will continue to find their way onto the streets of cities like Manchester and Liverpool.","Nous avons des lois strictes en Grande-Bretagne, mais sans cette loi européenne, les armes continueront à trouver leur chemin vers les rues de villes comme Manchester et Liverpool."
413,"A citizens' initiative was created by a small group of people, coordinated by one of my fellow countrymen, Helmut Schaupensteiner, and backed by a highly committed journalist, Maggie Entenfeller.","Un petit groupe a lancé une initiative citoyenne, sous la coordination de l'un de mes compatriotes, Helmut Schaupensteiner, et avec le soutien d'une journaliste très engagée, Maggie Entenfeller."
414,"Cross-compliance could be a force for good, and those who do the inspections should have clear and proper training and know their responsibilities.","La conditionnalité pourrait être une force positive et les personnes qui mènent les inspections doivent avoir suivi des formations claires et adéquates, elles doivent connaître leurs responsabilités."
415,"The consequence has been very many minor incidents, some accidents and some disasters in Europe's airspace.","Il en a résulté un grand nombre d'incidents mineurs, quelques accidents et quelques catastrophes dans l'espace aérien de l'Europe."
416,in writing. - (IT) We asked the European Parliament to deal seriously with the problem of terrorism at the July part-session.,par écrit. - (IT) Nous avons demandé au Parlement européen de traiter sérieusement le problème du terrorisme lors de la plénière de juillet.
417,"As Mr Stevenson has quite rightly said, the sheep is an animal that is not of huge value, so all of this is not going to be done by veterinarians.","Comme M. Stevenson l'a dit à juste titre, le mouton n'est pas un animal de grande valeur, les opérations ne seront donc pas effectuées par des vétérinaires."
418,"Lifestyle criticism, which Mr Verheugen mentioned, has long been an unpleasant aspect of the European climate debate.","La critique de notre mode de vie, dont M. Verheugen a parlé, est depuis longtemps un aspect déplaisant du débat européen sur le climat."
419,"Ultimately, we MEPs represent the people and the people are asking us to concern ourselves with the least well-off as well.","Enfin, nous, députés européens, représentons les citoyens et ceux-ci nous demandent également de nous occuper des moins favorisés."
420,It has implemented many successful reforms but still has to implement others and we must help it in that respect.,"Elle a mis en œuvre de nombreuses réformes avec succès, mais doit encore en mettre d'autres en place, et nous devons l'aider à cela."
421,"We will see how to get around this, but there is always the problem of distrust between police authorities.","Nous trouverons le moyen de dépasser cela, mais il y a toujours le problème de la méfiance entre autorités de police."
422,I would like to make the following proposal for the voting: we shall begin with the explanations of vote and then suspend the sitting at 1 p.m..,"(EN) Je voudrais faire la proposition suivante pour le vote: nous commencerons par les explications de vote orales, puis interromprons la séance à 13 heures."
423,"The European Court of First Instance in December 2006, and the British courts last November, ruled that there are absolutely no grounds to isolate the Iranian opposition like this.","Le Tribunal européen de première instance, en décembre 2006, et les tribunaux britanniques, en novembre dernier, ont estimé qu'il n'y avait absolument aucune raison d'isoler l'opposition iranienne de la sorte."
424,President-in-Office. - (SL) I am happy to be here with you today and to take part in such an important debate.,Président en exercice. - (SL) Je suis ravi d'être présent parmi vous aujourd'hui pour prendre part à un débat aussi important.
425,"I welcome the compromise that has been found with the Council, which now gives us a more balanced document, the details of which are to be voted on tomorrow by the Members of this Parliament.","Je me réjouis du compromis trouvé avec le Conseil, qui permet aujourd'hui de disposer d'un texte équilibré, dont les termes seront soumis demain au vote des membres du Parlement européen."
426,"Since the present Government came to power in the autumn of 2006, we have also seen how popular support for the European Union has grown in Sweden.","Depuis l'arrivée au pouvoir de l'actuel gouvernement en automne 2006, nous avons vu à quel point le soutien populaire à l'Union européenne a grandi en Suède."
427,"This vast and strategically vital region is being pulled three ways: by China, by Russia and by Europe.","Cette vaste région, stratégiquement vitale, est aujourd'hui courtisée par la Chine, la Russie et l'Europe."
428,"That period started in 1975 with the Helsinki Final Act, and its consequences were most influential in eastern and central Europe, where the Berlin wall and the communist system collapsed in 1989.","Elle a débuté en 1975 par l'Acte final de l'accord d'Helsinki, avec des conséquences de grande portée en Europe de l'est et en Europe centrale, où le mur de Berlin et le système communiste se sont effondrés en 1989."
429,"In other words, we believe that competitiveness must not be a substitute for convergence in the Member States and regions which are lagging behind in their socioeconomic development.","En d'autres termes, nous pensons que la compétitivité ne doit pas être un substitut à la convergence dans les États membres et dans les régions qui sont en retard dans leur développement socio-économique."
430,In order to achieve a safer Information Society the specific products and services should include mechanisms for data protection even from the design stage.,"Afin de créer une société de l'information plus sûre, les produits et services concernés devraient comporter des mécanismes de protection des données dès le stade de leur conception."
431,"We do not see EU fisheries agreements as a viable means, in the long term, of combating poverty and supporting development.","Nous ne considérons pas les accords de pêche de l'UE comme un moyen viable, à long terme, de lutter contre la pauvreté et de soutenir le développement."
432,Many of you will agree with me that the emerging market for biomass and biofuels presents many new opportunities for the farmer.,Beaucoup d'entre vous seront d'accord avec moi pour dire que le marché émergent pour la biomasse et les biocarburants ouvre de nombreuses nouvelles perspectives à l'agriculteur.
433,With new agreements you obtained stronger competences in adopting legislation and appointing the top European political representatives.,"Grâce à de nouveaux accords, vous avez obtenu des compétences renforcées dans le domaine de l'adoption de la législation et de la nomination des plus hauts représentants politiques de l'Europe."
434,Nor should we forget that staff should also be capable of offering psychological support because many women have often been traumatised in the past.,"N'oublions pas non plus que le personnel carcéral devrait également pouvoir offrir un soutien psychologique, car de nombreuses femmes ont subi des traumatismes dans le passé."
435,"This calls for the introduction of provisions to protect European manufacturing, which is burdened by such high additional costs.","Ceci requiert l'introduction de dispositions de protection de la fabrication européenne, qui doit supporter des coûts supplémentaires si élevés."
436,"Since I would like to allow my colleague from the PPE-DE Group, Professor Trakatellis, to use some of my speaking time, I will now conclude my introduction.","Comme je voudrais permettre à mon collègue du groupe PPE-DE, le professeur Trakatellis, d'utiliser une partie de mon temps de parole, je conclus ici mon introduction."
437,"rapporteur. - (NL) Mr President, although I do not fundamentally disagree with Mr Cohn-Bendit regarding the name, I think that Mr Swoboda's proposal should be adopted.","rapporteur. - (NL) M. le Président, bien qu'au fond je sois d'accord avec M. Cohn-Bendit concernant le nom, je crois qu'il convient d'adopter la proposition de M. Swoboda."
438,"For end-stage failure of organs such as the liver, lung and heart, it is the only available treatment.","Elle constitue le seul traitement disponible pour la défaillance terminale d'organes tels que le foie, le poumon et le cœur."
439,"Amendment 7: The EPLP voted in favour of this amendment, as it is important that the Budgetary Control Committee has a right to scrutiny over the plans for both of these statutes.",Amendement 7: L'EPLP a voté en faveur de cet amendement. Il est en effet important que la commission du contrôle budgétaire ait le droit d'examiner avec la plus grande attention les projets pour ces deux lois.
440,"Workers are not aware of their rights, and Member States do not monitor whether the provisions of the Directive are being correctly applied.","Les travailleurs ne connaissent pas leurs droits, et les États membres ne vérifient pas si les dispositions de la directive sont appliquées correctement."
441,"In my report on the impact of foreign direct investment, I made a few critical observations on Chinese investments in Africa.","Dans mon rapport sur l'impact des investissements étrangers directs, j'avais proposé quelques considérations critiques sur les investissements de la Chine en Afrique."
442,"(PT) I should also like to express the extreme concern that the agricultural sector in the Azores, my region, has about the current situation.",(PT) J'aimerais également vous faire part de l'extrême préoccupation du secteur agricole aux Açores au sujet de la situation actuelle.
443,"We must give Georgia our support at a moment when the country fears further provocation, and even aggression, by Russia.","Nous devons soutenir la Géorgie à un moment où le pays craint la provocation, voire l'agression, de la part de la Russie."
444,It is also entirely legitimate for them to address these issues to the men and women in the institutions which prepare and take the decisions.,"Il est aussi tout à fait légitime qu'ils fassent part de ces problèmes aux hommes et aux femmes qui, au sein des institutions, préparent et adoptent les décisions."
445,"This must not allow us to lose sight of another essential issue, however: we now have a new situation in these markets which arises in both foodstuffs and energy.",Ceci ne doit toutefois pas nous faire perdre de vue un autre aspect essentiel: nous sommes confrontés à une nouvelle situation sur ces marchés tant pour les produits alimentaires que pour l'énergie.
446,Its potential is far from being exploited partly because the situation in the former Yugoslavia - situated in a central position of the river - has been blocking any initiative.,"Son potentiel est largement sous-exploité, en partie à cause de la situation dans l'ancienne Yougoslavie (située en position centrale sur le fleuve), qui a bloqué jusqu'à présent toute initiative."
447,"It is the starting point for any communication that you can communicate, hopefully, in your own language and understand what is being told, also in your own language.","Le point de départ de toute communication est de pouvoir s'exprimer dans sa propre langue et de comprendre ce qui est dit, dans sa propre langue également."
448,"This, in fact, is the crux of the matter: the contradiction between this country, this nation, this great people, its evolution and the project we wish to operate together.","Car c'est de cela qu'il s'agit: de la contradiction entre ce pays, cette nation, ce grand peuple, son évolution et le projet que nous voulons conduire ensemble."
449,"Because the situation differs between Member States, in our opinion there is no point in imposing a common standard.","Étant donné que la situation varie entre les États membres, nous pensons que l'imposition d'une norme commune n'aurait pas de sens."
450,"Alexander Kazulin, the most important political prisoner, a prisoner of conscience in contemporary Europe, is still in prison.","Alexandre Kozouline, le plus importants des prisonniers politiques, un prisonnier d'opinion dans l'Europe d'aujourd'hui, est toujours en prison."
451,The relationship between consumers and banks in Europe remains complicated because of the distortions that are a feature of the sector.,Les relations entre les consommateurs et les banques en Europe restent compliquées du fait des distorsions caractéristiques de ce secteur.
452,"Preservation of marine biodiversity will only be guaranteed if it is integrated vertically into the other Community policies, notably the EU's future maritime policy.","La préservation de la biodiversité marine ne sera garantie que si elle est intégrée de façon verticale aux autres politiques communautaires, notamment la future politique maritime de l'Union européenne."
453,"According to the European Commission, about 14% of Poles, Greeks and Portuguese in permanent employment live in poverty.","Selon la Commission européenne, environ 14 % des Polonais, des Grecs et des Portugais titulaires d'un contrat de travail à durée indéterminée vivent dans la pauvreté."
454,The European Parliament also supported the targets set then and formulated proposals which the Council studied with great interest.,Le Parlement européen a également soutenu les buts fixés et a formulé des propositions que le Conseil a étudiées avec le plus grand intérêt.
455,The key aspects of the package of proposals that we have put forward and are now being considered by this Parliament will make a decisive contribution.,Les éléments clés du paquet de propositions que nous avons avancé et qui est actuellement examiné par ce Parlement seront cruciaux à cet égard.
456,I believe that it is vital to focus aid on the fleets which are most dependent on fuel and thus most affected by the current overcapacity.,Je pense qu'il est crucial de se concentrer sur les flottes qui sont très dépendantes du gazole et donc particulièrement touchées par la surcapacité actuelle.
457,"Whenever there is an international crisis, you seek to blame that for the problems in the fishing industry.",Vous imputez les problèmes rencontrés dans le secteur de la pêche à chaque nouvelle crise internationale.
458,"Only three Member States have their own risk assessment procedures: the United Kingdom, France and Denmark.","Seuls trois États membres disposent de leurs propres procédures d'évaluation des risques: le Royaume-Uni, la France et le Danemark."
459,"These dockyards have been continuously providing not only for themselves, but also for Maltese industry, highly trained tradesmen.","La réparation navale a toujours formé des artisans hautement qualifiés, non seulement pour le secteur lui-même, mais pour l'ensemble de l'industrie maltaise."
460,This would have put more emphasis on exchanging best practices and on technological developments in the area of urban mobility.,Elle aurait mis plus l'accent sur l'échange des meilleures pratiques et sur les développements technologiques dans le domaine de la mobilité urbaine.
461,"In the face of economic globalisation, it makes sense to extend the European legal and economic space and thus to make the wider Europe stronger in terms of our soft regulatory power.","Dans un contexte de mondialisation économique, il est judicieux de vouloir élargir l'espace économique et juridique européen et, partant, de renforcer notre pouvoir réglementaire non contraignant dans l'Europe au sens large."
462,"I will briefly go over the measures taken by the Commission, which is of course extremely vigilant when it comes to these matters.","Je rappelle brièvement les démarches de la Commission qui, en ce qui concerne ces problèmes, est évidemment très vigilante."
463,"South Ossetia, Abkhazia and Transnistria are in a similar position - for years Russia has been refusing to withdraw its forces from there.","L'Ossétie du Sud, l'Abkhazie et la Transnistrie sont dans une position similaire - depuis des années, la Russie refuse de retirer ses troupes de ces régions."
464,"We can be pleased about this, but it must be ensured that the Fund is accessible to all those who might benefit from it.","Nous pouvons nous en réjouir, mais nous devons veiller à ce que le Fonds soit disponible pour tous ceux qui pourraient en avoir besoin."
465,"Internet service providers must play their part in preventing their platform being used for destructive forces like libel, hate and exploitation.","Les fournisseurs de services internet doivent jouer leur rôle pour éviter que leur plate-forme ne soit utilisée à des fins destructrices comme la diffamation, la haine et l'exploitation."
466,"We also hope that, for transactions to be secure, the unification of rules on conflict of laws should precede the unification of the substantive rules.","Nous souhaitons par ailleurs que, pour la sécurité des transactions, l'unification des règles de conflits de lois précède l'unification des règles de fond."
467,"The definition of 'parent carrier' has led to heated debates, since the obligations imposed on those companies are very burdensome.","La définition de ""transporteur associé"" a suscité des discussions animées, étant donné que les obligations imposées à ces compagnies sont fort contraignantes."
468,"These questions are, of course, also being raised in our ongoing exercise concerning public funds and the health, education and employment sectors.","Nous soulevons bien sûr aussi ces questions dans le cadre de nos activités en cours dans le domaine des fonds publics et dans les secteurs de la santé, de l'éducation et de l'emploi."
469,"It is a fact, however, that the Commission's proposal is based on the Council of Europe Convention and very closely follows the definitions of offences in the Convention, for two reasons.",Mais il est un fait que la proposition de la Commission est basée sur la convention du Conseil de l'Europe et elle suit de très près les définitions des infractions pour une double raison.
470,"Irrespective of its technical condition, a ship in danger must have access to a specially designated and equipped refuge area.","Quelle que soit sa condition technique, un navire en danger doit pouvoir accéder à une zone de refuge spécifiquement conçue et équipée à cet effet."
471,"However, there is a way of understanding the universe in which we live as being shared by all - a plane of existence that spans the reality of every human person - an ecosphere that contains us all.","Cependant, il est possible de concevoir l'univers dans lequel nous vivons comme un espace partagé par tous; un lieu d'existence qui transcende la réalité de chacun; une écosphère qui nous abrite tous."
472,"If nothing is done, the UN Food and Agriculture Organisation (FAO) warns that the already high consumption of meat will double by 2050.","En l'absence de mesures, l'Organisation des Nations unies pour l'alimentation et l'agriculture (FAO) prédit que la consommation de viande, déjà élevée, doublera d'ici 2050."
473,"English teachers, for example, are provided by the United Kingdom; in other words, the burden for bigger languages is correspondingly much higher.","Les professeurs d'anglais, par exemple, sont fournis par le Royaume-Uni. En d'autres termes, la charge relative aux langues plus importantes est également beaucoup plus élevée."
474,"On 1 October, Dr Frederick Toben was arrested at Heathrow Airport on a European arrest warrant issued in Germany for alleged xenophobic crimes committed on the Internet.","Le 1er octobre, le Dr Frederick Toben a été arrêté à l'aéroport d'Heathrow sur un mandat d'arrêt européen émis en Allemagne, pour crimes xénophobes présumés commis sur l'internet."
475,"In addition, these workers are exposed to health and safety risks and have few opportunities for professional development.","En outre, ces travailleurs s'exposent à des risques pour leur santé et leur sécurité et ne disposent que de rares occasions de développement professionnel."
476,"Students from third countries are coming to us, yet some of their countries of origin are still not democratic, unfortunately.","Les étudiants des pays tiers viennent en Europe, et pourtant certains de leurs pays d'origine ne sont toujours pas démocratiques, malheureusement."
477,I agree that this is a global crisis and I therefore agree with the need for a Bretton Woods that some are calling Mark II and others are calling Mark III.,"Je conviens qu'il s'agit d'une crise planétaire et par conséquent je conviens de la nécessité d'un nouveau Bretton Woods, que certains appellent Mark II et d'autres Mark III."
478,"Now more than ever, Vietnam must, on the contrary, establish mechanisms intended to allow peaceful expression of the tensions and social frustrations being felt in that country.","Plus que jamais, le Viêt Nam doit, au contraire, se doter des mécanismes destinés à permettre aux tensions et aux frustrations sociales à l'œuvre dans ce pays de s'exprimer pacifiquement."
