,en,fr
636,"To achieve this, we must also equip ourselves with modern, competitive industry that makes a clean break with the old method of industrial policy making.","Pour aboutir à cela, nous devons également nous doter d'une industrie moderne et compétitive qui rompe clairement avec l'ancienne manière d'élaborer des politiques industrielles."
637,"I therefore ask you to put to the House the proposal to modify the agenda that all votes today take place before Mr Schmitt's speech, and we start on the basis of the calendar votes.","Je vous prie donc de soumettre à l'Assemblée la proposition de modifier l'ordre du jour, afin que les votes d'aujourd'hui aient tous lieu avant l'intervention de M. Schmitt, en commençant par les votes sur le calendrier."
638,They are an inalienable privilege of the individual and must not be brought into question by any political regime.,"Ils représentent un privilège inaliénable de l'individu et ne peuvent être remis en cause par un régime politique, quel qu'il soit."
639,"Let the Libyans solve their problems themselves, otherwise we might see get a full-scale rebellion in Arab countries!","Laissons les Libyens résoudre leurs problèmes eux-mêmes, faute de quoi nous risquerions de voir naître une révolution à grande échelle dans tous les pays arabes!"
640,The people of Lithuania are actively raising funds and trying in every way possible to contribute to aid for the country's victims.,Les Lituaniens lèvent activement des fonds et tentent de toutes les manières possibles d'aider les victimes.
641,We welcome the fact that the Hungarian Presidency is actively engaged in the issue of data protection.,Nous saluons le fait que la Présidence hongroise s'engage de manière active sur la question de la protection des données.
642,Recent cyber attacks in the Member States are making us rethink and reformulate the Agency's mandate to attain a more flexible response capability and to bolster the Agency's operational efficiency.,Les cyber-attaques récemment menées dans les États membres nous poussent à repenser et à reformuler le mandat de l'Agence en vue de la mise en place d'une capacité de réaction plus souple et du renforcement de son efficacité opérationnelle.
643,"But before we activate this mechanism, I am calling - and I will continue to call - on Member States to put solidarity into action: not only to come out with beautiful words, but to act.","Mais avant que nous activions ce mécanisme, j'appelle et continuerai à appeler les États membres à traduire leur solidarité en action: pas seulement à prononcer de grands mots, mais à agir."
644,"There are reasons for migration flows. The most important of these are factors such as wars and armed conflicts, systematic human rights violations, and ethnic and religious conflicts and repression.","Les flux migratoires ont des causes, dont les plus importantes sont les guerres et les conflits armés, les violations systématiques des droits de l'homme, les conflits ethniques et religieux et la répression."
645,It is instead a collection of empty words that once again highlight the fact that the European Union provides no added value at all.,"Il s'agit au contraire d'un ensemble de paroles creuses soulignant, une fois de plus, le fait que l'Union européenne ne présente pas la moindre valeur ajoutée."
646,"He recently brought forward a written declaration in support of small businesses, but only got just over 200 signatures.","Il a récemment déposé une déclaration écrite en soutien des petites entreprises, mais a recueilli à peine un peu plus de 200 signatures."
647,I voted in favour of Amendment 15 not to increase Members' salaries and allowances because we are in a crisis.,"par écrit. - J'ai voté en faveur de l'amendement 15 pour ne pas que soient augmentés les salaires et les indemnités des députés, car nous sommes en période de crise."
648,"Instead, it would be most expedient to prudently take account of the effects of the individual scenarios.",Il serait par contre plus judicieux de tenir prudemment compte des incidences des différents scénarios envisagés.
649,The important element of the response to this question lies with the European Investment Bank and its family of institutions.,Ce sont la Banque européenne d'investissement et son cercle d'institutions qui détiennent l'élément important de la réponse à cette question.
650,We are currently facing a refugee crisis in the area and many regimes are turning on their own people.,"Nous assistons actuellement à une crise des réfugiés dans la région, et de nombreux régimes se retournent contre leurs propres populations."
651,I think it is fair to make a distinction between child labour in manufacturing and child labour in agriculture.,Je pense qu'il convient d'établir une distinction entre le travail des enfants dans le secteur manufacturier et le travail des enfants dans l'agriculture.
652,"The Internal Audit Service (IAS) has made 48 recommendations on grant management, 27 of which even fall into the 'critical' category.","Le service d'audit interne (SAI) a effectué 48 recommandations sur la gestion des subventions, 27 sont tombées dans la catégorie ""décisives""."
653,"These measures will be intrinsically linked to all of the other proposed long-term measures, in preparation for a common migration policy.",De telles mesures seront intrinsèquement liées à l'ensemble des mesures envisagées à long terme dans la perspective d'une politique migratoire commune.
654,We should make every effort to improve our research activities in this area so that valuable materials can be segregated at the end of the product lifecycle.,"Nous devons faire tous les efforts possibles pour améliorer nos activités de recherche dans ce domaine, afin que les matériaux qui ont de la valeur puissent être séparés en fin de cycle de vie des produits."
655,"Origin marking would facilitate consumer choice and contribute to reducing fraudulent, inaccurate or misleading claims of origin.","Le marquage de l'origine faciliterait les choix des consommateurs et contribuerait à réduire l'importance des titres d'origine frauduleux, inexacts ou trompeurs."
656,As if we should even be asking ourselves whether or not to label products sold on the European market when the consumer's freedom of choice is fundamental in European law!,Comme si nous devions même nous poser la question de savoir s'il convient ou non d'étiqueter les produits vendus sur le marché européen alors même que le libre choix du consommateur est quelque chose de fondamental dans le droit européen.
657,"In the dioxin scandal, we have seen how easily they can be undermined, if individual 'black sheep' behave in a very negligent way.","Dans le cas du scandale de la dioxine, nous avons pu constater à quel point cela constitue un rempart peu efficace lorsque certaines ""brebis galeuses"" se comportent de manière particulièrement irresponsable."
658,"The current sales dynamic does not allow fluctuations in production costs, including oil, to impact on fish prices; the current import policy contributes to this, amongst other factors.","La dynamique des ventes actuelle ne permet pas aux fluctuations des coûts de production, notamment le pétrole, d'avoir une incidence sur les prix du poisson; la politique d'importation actuelle contribue, entre autres facteurs, à ce phénomène."
659,"It is important, therefore, to continue the reforms under way regarding the governance of that international institution, and particularly the ones that you also mentioned, Commissioner.","Il convient, à cet égard, de poursuivre les réformes engagées dans la gouvernance de cette institution internationale, et notamment celles que vous avez également rappelées, Monsieur le Commissaire."
660,"It is also a fact that the extent of problems that can be associated with road transport, such as air and noise pollution, as well as traffic congestion, are becoming ever more severe.","Il est également indéniable que les problèmes liés au transport routier, comme la pollution atmosphérique et sonore ou la congestion, ne cessent de s'aggraver."
661,"I sincerely believe that we are all definite about one thing: any escalation of violence must be avoided, as it could result in further human casualties.","J'estime sincèrement que nous sommes tous d'accord sur un point: toute escalade de la violence doit être évitée, car cela pourrait entraîner de nouvelles pertes de vies humaines."
662,"It is worth bearing in mind that farmers have very low incomes, in spite of the support they receive from the European budget.",Il ne faut pas oublier que les agriculteurs ont des revenus très faibles malgré le soutien qu'ils reçoivent du budget européen.
663,"This report also reminds us of the need for a strategy for the future of education and, above all, for guidance on all the professional needs that Europe will have in the near future.","Ce rapport nous rappelle également qu'il faut une stratégie pour l'avenir de l'enseignement et, surtout, des orientations concernant les besoins en qualifications que l'Europe exprimera dans un avenir proche."
664,In the past - even long before the European Union existed - Europe too often held back on criticising abuses in Member States.,"Autrefois, et même bien longtemps avant la naissance de l'Union européenne, l'Europe s'est abstenue bien trop souvent de critiquer les abus commis dans les États membres."
665,"Safety limits, which, on this occasion, exceed the limits of any hypothetical accident, will be reassessed by the Member States.",Les États membres réévalueront leur niveau de sécurité pour s'assurer que celui-ci permette de résister à tout accident éventuel.
666,"The key objective, however, would be the adoption of the 'six-pack,' the legislative package on economic governance.","Mais l'objectif le plus important et l'adoption du ""paquet de six"", le paquet législatif sur la gouvernance économique."
667,All of these activities must be subject to strict controls in compliance with international standards.,Toutes ces activités doivent être soumises à des contrôles sévères conformes aux normes internationales.
668,"We believe that his nomination is a success for Italy, which he will be able to represent at a high level in one of the most prestigious European institutions.","Nous voyons sa nomination comme un succès pour l'Italie, qu'il pourra représenter dans les hautes sphères, à la tête d'une des institutions européennes les plus prestigieuses."
669,The regulation on enforcement measures to correct excessive macroeconomic imbalances in the euro area is another key piece of the legislative package on economic governance.,Le règlement établissant des mesures d'exécution en vue de remédier aux déséquilibres macroéconomiques excessifs dans la zone euro est l'une des pièces maîtresses du paquet législatif sur la gouvernance économique.
670,"Madam President, the Customs 2000 programme is very important and it is still more important to launch it with realistic objectives.","Madame le Président, le programme Douane 2000 est très important, et plus important encore est qu'il soit mis en place avec des objectifs réalistes."
671,"What will happen to decision-taking, to the institutions, to the community budget in general and the budget headings for the cohesion funds and structural funds in particular?","Qu'en sera-t-il de la prise de décision, des institutions, du budget communautaire en général et des lignes communautaires pour le Fonds de cohésion et les fonds structurels en particulier?"
672,It is clear as well that the actions of the market in the longer term will lead to lower interest rates which will make it cheaper to borrow for investment and in turn will create jobs.,"Cela est clair, étant donné que les activités des marchés à long terme conduiront vers une baisse des taux d'intérêt qui permettront d'emprunter pour investir à des meilleures conditions, ce qui à son tour créera des emplois."
673,Masses of refugees are leaving the country and choosing the road to Zaire where there are already 1 million Rwandan refugees.,"Des réfugiés quittent le pays en masse et tentent de trouver asile au Zaïre qui abrite déjà 1, 5 million de réfugiés rwandais."
674,I think that must be said from the outset if we really want to clarify the scale of the problem facing us.,Je crois qu'il était nécessaire de le dire d'emblée pour bien montrer l'ampleur du problème auquel nous sommes confrontés.
675,"But the position here is different: as the introduction of a new institutional framework or new rules and disciplines was not provided for, the criteria under Article 228(3)(1) do not apply.","La situation actuelle est cependant différente: l'introduction d'un nouveau cadre institutionnel ou de nouvelles normes ou disciplines n'étant pas prévue, le critère dont on parle à l'article 228, paragraphe 3, deuxième alinéa, n'est pas d'application."
676,In the UK alone it will not be possible to meet the 1996 fleet reduction requirements. We have to deal with this problem.,"Rien qu'au Royaume-Uni, il sera impossible de respecter les exigences de réduction de la flotte pour 1996."
677,"Madam President, at the request of the rapporteur, we have just confirmed our opinion, which seems to me essential.","Madame le Président, nous venons, à la demande du rapporteur, de confirmer notre avis, ce qui me semblait essentiel."
678,"In my view his statements today have made this very plain, because he keeps confusing the fire-fighters with the arsonists.",J'estime personnellement que les propos qu'il a tenus aujourd'hui le confirment à l'évidence car il confond sans cesse les pompiers et l'incendiaire.
679,"Mr Prodi, President-in-Office of the Council, who chaired the European Council meeting in Florence, will be reporting to you on this shortly.","Tout à l'heure, M. Prodi, le président en exercice du Conseil, qui a présidé le Conseil européen de Florence, vous en fera rapport."
680,"Their small scale moreover prevents them from taking in experts in all fields, so that there is a danger of chronic lack of information.","De plus, leur modeste importance les empêche de faire appel à des experts dans tous les domaines et elles sont menacées d'un manque constant d'informations."
681,I rise on a point of order because I am becoming a little concerned about the number of Members going over their speaking time.,Permettez-moi de soulever un point de procédure et de dire que la quantité d'orateurs ayant dépassé leur temps de parole commence sérieusement à me préoccuper.
682,"We have asked for the Act to be rejected clearly and energetically, not only the third chapter - but obviously the third chapter in particular, which contaminates international relations.",Nous exigeons un refus net et énergique du chapitre trois qui pollue les relations internationales.
683,"The working group is considering all issues: nothing is ruled in and nothing is ruled out, and the Council does not rule out sanctions; all issues by way of response are under examination.","Le groupe de travail considère actuellement les différentes questions. Rien n'est décidé, rien n'est exclu, le Conseil n'émettant d'ailleurs pas de sanctions."
684,"Community programmes involve all the priority sectors: housing, employment, transport, energy, water supplies, telecommunications and health care.","Les programmes communautaires concernent tous les secteurs prioritaires: logement, emploi, transports, énergie, adduction d'eau, télécommunications et soins de santé."
685,"But reports reaching me so far are that there is no evidence of such large-scale fraud. To my great surprise, I have to say.","Mais selon les informations que j'ai pu recevoir, il est impossible d'apporter la preuve d'une quelconque fraude, et ce à mon grand étonnement."
686,"Finally, let me make it clear that the Liberal Group can only support this report if a number of amendments are adopted and a considerable number of paragraphs are dropped from the resolution.",Je conclurai en précisant que le groupe libéral ne soutiendra ce rapport que s'il est assorti de et corrigé par divers amendements et si un grand nombre de paragraphes disparaissent de la résolution.
687,"The huge differences in national legislation and the impossibility of monitoring everything on the European market closely make some kind of common structure necessary, and this is what we now have.","Les grandes différences entre les législations nationales, et par conséquent l'impossibilité de tout contrôler convenablement sur le marché européen, rendaient une structure commune indispensable."
688,Despite some promising statements from the new prime minister there has been no follow-up with regard to the Kurdish question.,Les quelques déclarations prometteuses faites par le nouveau premier ministre au sujet de la question kurde sont restés sans suite.
689,Paedophiles are organizing networks to exchange information and entice children into their sordid world.,Les pédophiles organisent des réseaux pour échanger des informations et entraîner des enfants dans leur monde sordide.
690,"Secondly, the European Union and Member States are the principal providers of finance for the UNRWA - i.e. the UNRWA is directly dependent upon the Community budget.","Deux: l'Union européenne et les États membres sont les principaux financiers de l'UNRWA, c'est-àdire que l'UNRWA dépend directement du budget communautaire."
691,"No-one can defend the tariffs as they were years ago. These were very often, and rightly so, criticized in this House.","Personne ne peut désormais appliquer des tarifs comparables à ceux en vigueur il y a quelques années, fortement critiqués d'ailleurs au sein même de cette Assemblée."
692,The full benefit of all these will not be felt until we move towards pan-European rules of cumulation.,Le bénéfice total de celle-ci ne sera pas perçu tant que nous n'aurons pas établi de règles de cumul paneuropéennes.
693,"We hear stories of Afghan women and girls who have been banned from working, from attending school, from leaving their houses unless accompanied by a male relative.","Nous entendons des récits de femmes et de filles afghanes empêchées de travailler, d'aller à l'école, de quitter leur maison sans être accompagnées par un parent de sexe masculin."
694,"Since 1980 one and a half billion people in 15 countries, that is a quarter of the world's population, have enjoyed a spectacular economic growth.","Depuis 1980, 1 milliard et demi d'individus, ont, dans 15 pays, bénéficié d'une croissance économique spectaculaire, soit un quart de la population mondiale."
695,"Of course, it is also possible to imagine that a public service can exist and provide certain services without operating with optimum efficiency.","On peut naturellement aussi imaginer l'existence d'un service public qui peut fournir certaines prestations, sans travailler à son optimum."
696,"Co-existence seems a remote, unattainable goal; the ancient hatreds inspiring these two ethnic factions cannot be overcome.",La coexistence semble lointaine et irréalisable; la haine ancestrale qui anime les deux ethnies ne peut être éradiquée.
697,I believe it is essential for the European Union to promote various Community programmes for those Mediterranean countries which have a serious problem of water shortage.,"A cet égard, je considère qu'il est indispensable pour l'Union européenne de promouvoir les différents programmes communautaires pour les pays méditerranéens qui connaissent un grave problème de ressources hydriques."
698,"The same applies to other more important amendments, and in this case I accuse the Commission of having capitulated far too easily.","C'est la même chose en ce qui concerne d'autres amendements plus importants, où là, je reproche à la Commission d'avoir capitulé beaucoup trop vite."
699,"Some earlier speakers have already stated that there is no magic solution to the problem of unemployment - in fact, a number of effective solutions must be sought.",Certains des orateurs qui m'ont précédé l'ont mentionné: il n'existe pas de solution magique pour résoudre le problème de l'emploi. Il faut rechercher de nombreuses solutions efficaces à cet égard.
700,"On the other hand we do have provisions, in the Danish legislative system, which make it possible to ban parties if they make use of force and are therefore unacceptable.","La constitution danoise contient, par contre, des règles permettant d'interdire des partis qui ont recours à la violence."
701,"It is a very fundamental part of the contribution I made but because of all the noise in Parliament, it was lost on that occasion.","Cet aspect constituait une partie importante de mon intervention mais en raison du vacarme régnant dans l'hémicycle, l'information n'a pas été consignée."
702,"In connection with this, the amendment on the principle of non discrimination is extremely important.","Dans ce contexte, l'amendement sur les principes de non discrimination est primordial."
703,This report on telecommunications forcefully reasserts the need to improve the European public service at the same time as telecommunications are liberalized in our information society.,Ce rapport sur les télécommunications affirme avec force la nécessité du renforcement du service d'intérêt général au niveau européen pour accompagner la libéralisation des télécommunications dans notre société d'information.
704,"We should give our full attention to this aspect in future, especially in the light of the revision of the Treaties, and with a view to the next conference of the World Trade Organization.","Monsieur le Président, mes chers collègues, cet aspect mérite à l&#x02BC;avenir toute notre attention, principalement à la lumière de la révision des Traités et de la prochaine conférence de l&#x02BC;Organisation mondiale du commerce."
705,"In numerous documents, and recently the report on a citizens' network, Parliament has emphasized the social importance of public transport.","Que ce soit dans le rapport publié récemment sur le citizens network ou dans bon nombre d'autres documents, le Parlement a à maintes reprises souligné l'intérêt social que présentent les transports publics."
706,"It is true that the three countries are a long way from the EU, but their history brings them closer to us.","Certes, ces trois pays sont éloignés de l'Union européenne, mais leur histoire les rapproche de nous."
707,"After this first initiative, the Commission has not re-examined the matter nor, despite constant pressure from Parliament, has it taken any other initiative.","Après cette première initiative, la Commission n'a plus procédé à l'examen de cette question ni pris d'autres initiatives, en dépit des pressions incessantes du Parlement européen."
708,"In the course of our work, we received several kilos of documentation from the Commission, the Council, government bodies, and national and international scientific institutions.","Mais, en définitive, pendant la période où nous avons travaillé, nous avons reçu de nombreux kilos de documentation de la Commission, du Conseil, d'instances gouvernementales et d'institutions scientifiques nationales et internationales."
709,"Madam President, ladies and gentlemen, a proposal from the Commission is on the table today, aimed at establishing common rules for the control of animal products from third countries.","Madame le Président, Mesdames et Messieurs, la proposition de la Commission qui nous est soumise, a pour but de fixer des règles communes pour le contrôle vétérinaire des produits à base de viande bovine en provenance de pays tiers."
710,"Fortunately, the Committee on Legal Affairs and Citizens' Rights approved this report, thereby avoiding prolonged debate on the technical complexity of the proposal.","Heureusement, la commission juridique a approuvé ce rapport en évitant de longues discussions sur la complexité technique de la proposition."
711,"If that happens, then the European Council will in my view have done something positive for the Union and for the Member States, but especially for the developing countries.","Si tel est le cas, le Conseil européen aura, me semble-t-il, accompli une démarche positive pour l'Union, les États membres et surtout en faveur des pays en voie de développement."
712,It is just as important to promote and foster the creativity of all those involved in the production process.,Il est tout aussi essentiel d'encourager la créativité de tous les participants au processus de production.
713,"Nevertheless, within the agreement there are some new developments which show exciting possibilities for using these agreements towards the development end of the spectrum.","Il y a néanmoins, au coeur de l'accord, certains éléments nouveaux qui ouvrent des perspectives passionnantes en élargissant le spectre des possibilités d'utilisation de ces accords."
714,The main subjects on which we consider the state of negotiations at the Intergovernmental Conference to be absolutely unsatisfactory have been referred to on several occasions today.,"Mais nous avons aussi des raisons de nous préoccuper de l'avenir de l'Europe. Les thèmes les plus importants, au sujet desquels l'état actuel des négociations préparatoires à la Conférence intergouvernementale nous paraît tout à fait insuffisant, ont déjà été abordés à plusieurs reprises aujourd'hui."
